SolutionId,FeatureTitle,Description
10,Designed by our quants,"Created by our quants, for our quants. Our analytics tools are trusted daily by over a thousand quantitative developers at Goldman Sachs to manage our global trading business."
10,Comprehensive and cross-asset,"Our business covers all asset classes. Our financial toolkit is designed from the ground up to be a complete solution for all markets, delivered through an intuitive interface."
10,Proven by markets,Leverage models and datasets which have been tested and refined through decades of experience at the center of global derivatives markets. Use what we use.
12,A New Face for the Firm,"Take a tour of the design features of Goldman Sans, a custom typeface designed for the needs of digital finance."
12,Creating Our Color System,"Learn about the research and testing that went into creating our color palette to ensure versatility, accessibility, consistency, and scalability."
12,A Matter of Principle,Knowing how and why we design informs what we design.
9,"Competitive, Fixed Interest Rates","Keep borrowing costs predictable with a fixed interest rate, ranging from 8.99% to 16.99%"
9,Request funds as needed,"Build inventory, fund operations and take advantage of opportunities"
9,See options in two steps,"Our 100% digitial experience makes it simple to see options for your business without impacting your personal credit score, after we get some basic information"
7,Market Strategy,Complex markets can be difficult to decipher. We provide investment professionals and their clients with a global perspective to help explain the issues and trends affecting their portfolios
7,Authentic Source of Information,"As one of the world's leading asset managers, we provide original, real time, reliable and fundamental insights and analysis"
7,Most of its text is made ,"Most of its text is made up from sections 1.10.32–3 of Cicero's De finibus bonorum et malorum (On the Boundaries of Goods and Evils; finibus may also be translated as purposes). Neque porro quisquam est qui dolorem ipsum quia dolor sit amet, consectetur, adipisci velit is the first known version (""Neither is there anyone who loves grief itself since it is grief"
2,Data Management,Remove the complexity of building and supporting a data management system by bringing your own data into Goldman Sachs' managed tick database.
2,Curated Data,Access institutional grade GS curated financial markets data including select third-party data products sourced via AWS Data Exchange - all mapped to a consistent data model
2,Data Analytics,Accelerate time to market by rapidly turning data into actionable insights with our suite of tools for data visualization and analysis
1,Reliable and Trusted Industry Leaders,Together with AWS we have collaborated to create new solutions for financial services organizations
1,Simple Steps,Our Api's and services are easy to understand and we will guide you through from registering an application to authentication of your first API call.
1,In a professional context,"In a professional context it often happens that private or corporate clients corder a publication to be made and presented with the actual content still not being ready. Think of a news blog that's filled with content hourly on the day of going live. However, reviewers"
5,Cutting Edge Technology,"As one of the world's leading asset managers, we have the know how and technology to provide you with the best hedging strategies"
5,Cash Managment,Ability to move cash rapidly and seamlessly with careful and transparent oversight in place
5,Customizable,"Customize and share your view, upload multiple payments/receipts, instructions, or journals, and approve with two clicks"
4,Independent Source,Providing independently caclulated solutions that our clients need to meet specific investment criteria
4,Bespoke Trade Implementations,"With our proprietary index solutions, we can develop bespoke trade implementations for your needs"
4,Access to Global Prime Services,Through usm you will have access to our suite of global prime services
3,Inform your investment strategy,"With our data, risk and analytics suite you will be empowered to make the best investment strategy"
3,Comprehensive Support,We provide our clients with a global perspective to help explain the issues and trends affecting their portfolios
3,Market Models,Leverage our models to create a bespoke strategy tailored to your needs
6,Stay informed and ahead of the curve,Leverage our models and stay ahead of the curve with market downturns and risks
6,Weekly updates,Weekly updates on key developments across macro and micro views
6,Trusted partner,"With over 150 years of experience in this field, our data and analysis is trusted by many"
8,Payments,"Send, receive, and manage payments and accounts globally. For businesses who want to create modern, automated, and API-based payment experiences"
8,Treasury Automation,"Manage liquidity, move money, and automate key treasury functions. For Treasurers who want to upgrade to real-time"
8,Banking as a Service,Embed business bank account & payments experiences within your own products. For B2B software companies who want to expand their offering
14,Data at a glance,"Remove the complexity of understanding data, with our dashboard easily access and view your data at a glance."
14,Personally Curated Data,Access institutional grade GS curated financial markets data and news
14,All in One,An all in one platform to view and make informed decisions